{
  "sections": [
    "PLAYER_SETUP",
    "LAND_GENERATION",
    "ELEVATION_GENERATION",
    "CLIFF_GENERATION",
    "TERRAIN_GENERATION",
    "CONNECTION_GENERATION",
    "OBJECTS_GENERATION"
  ],
  "predefinedLabels": [
    {
      "name": "DEATH_MATCH",
      "category": "gameMode",
      "description": "Death match game mode.",
      "verified": true,
      "notes": "Sourced from the Definitive RMS Scripting Guide (Zetnus), Conditionals section."
    },
    {
      "name": "REGICIDE",
      "category": "gameMode",
      "description": "Regicide game mode.",
      "verified": true,
      "notes": "Sourced from the Definitive RMS Scripting Guide (Zetnus), Conditionals section."
    },
    {
      "name": "CAPTURE_THE_RELIC",
      "category": "gameMode",
      "description": "Capture the Relic game mode (HD/DE only).",
      "verified": true,
      "notes": "Sourced from the Definitive RMS Scripting Guide (Zetnus), Conditionals section."
    },
    {
      "name": "CAPTURE_RELICS",
      "category": "gameMode",
      "description": "Capture the Relic game mode under UserPatch (UP only; DE uses CAPTURE_THE_RELIC).",
      "verified": true,
      "notes": "Sourced from the Definitive RMS Scripting Guide (Zetnus), Conditionals section."
    },
    {
      "name": "RANDOM_MAP",
      "category": "gameMode",
      "description": "Standard random map game mode (UP/DE only).",
      "verified": true,
      "notes": "Sourced from the Definitive RMS Scripting Guide (Zetnus), Conditionals section."
    },
    {
      "name": "TURBO_RANDOM_MAP",
      "category": "gameMode",
      "description": "Random map with the turbo mode tickbox enabled (UP/DE only).",
      "verified": true,
      "notes": "Sourced from the Definitive RMS Scripting Guide (Zetnus), Conditionals section."
    },
    {
      "name": "WONDER_RACE",
      "category": "gameMode",
      "description": "Wonder Race game mode (UP/DE only).",
      "verified": true,
      "notes": "Sourced from the Definitive RMS Scripting Guide (Zetnus), Conditionals section."
    },
    {
      "name": "DEFEND_WONDER",
      "category": "gameMode",
      "description": "Defend the Wonder game mode (UP/DE only).",
      "verified": true,
      "notes": "Sourced from the Definitive RMS Scripting Guide (Zetnus), Conditionals section."
    },
    {
      "name": "EMPIRE_WARS",
      "category": "gameMode",
      "description": "Empire Wars game mode (DE only).",
      "verified": true,
      "notes": "Sourced from the Definitive RMS Scripting Guide (Zetnus), Conditionals section."
    },
    {
      "name": "BATTLE_ROYALE",
      "category": "gameMode",
      "description": "Battle Royale game mode (DE only).",
      "verified": true,
      "notes": "Sourced from the Definitive RMS Scripting Guide (Zetnus), Conditionals section."
    },
    {
      "name": "SUDDEN_DEATH",
      "category": "gameMode",
      "description": "Sudden Death game mode (DE only).",
      "verified": true,
      "notes": "Sourced from the Definitive RMS Scripting Guide (Zetnus), Conditionals section."
    },
    {
      "name": "KING_OT_HILL",
      "category": "gameMode",
      "description": "King of the Hill game mode (UP/DE only). Note the spelling: OT, not OF.",
      "verified": true,
      "notes": "Sourced from the Definitive RMS Scripting Guide (Zetnus), Conditionals section. The guide warns that KING_OF_THE_HILL is a map type rather than a game mode and is always true, so a script testing that name instead is always taking the branch."
    },
    {
      "name": "TINY_MAP",
      "category": "mapSize",
      "description": "Legacy name for the 120 x 120 map size (in-game description: Tiny).",
      "dimensions": 120,
      "mapSize": "Tiny",
      "verified": true,
      "notes": "Sourced from the Definitive RMS Scripting Guide (Zetnus), Conditionals section. Legacy and modern names are offset by one size from Normal upward: this label and MAPSIZE_TINY are the same 120 x 120 map. See docs/preview-design.md Sec.4."
    },
    {
      "name": "SMALL_MAP",
      "category": "mapSize",
      "description": "Legacy name for the 144 x 144 map size (in-game description: Small).",
      "dimensions": 144,
      "mapSize": "Small",
      "verified": true,
      "notes": "Sourced from the Definitive RMS Scripting Guide (Zetnus), Conditionals section. Legacy and modern names are offset by one size from Normal upward: this label and MAPSIZE_SMALL are the same 144 x 144 map. See docs/preview-design.md Sec.4."
    },
    {
      "name": "MEDIUM_MAP",
      "category": "mapSize",
      "description": "Legacy name for the 168 x 168 map size (in-game description: Medium).",
      "dimensions": 168,
      "mapSize": "Medium",
      "verified": true,
      "notes": "Sourced from the Definitive RMS Scripting Guide (Zetnus), Conditionals section. Legacy and modern names are offset by one size from Normal upward: this label and MAPSIZE_MEDIUM are the same 168 x 168 map. See docs/preview-design.md Sec.4."
    },
    {
      "name": "LARGE_MAP",
      "category": "mapSize",
      "description": "Legacy name for the 200 x 200 map size (in-game description: Normal).",
      "dimensions": 200,
      "mapSize": "Normal",
      "verified": true,
      "notes": "Sourced from the Definitive RMS Scripting Guide (Zetnus), Conditionals section. Legacy and modern names are offset by one size from Normal upward: this label and MAPSIZE_NORMAL are the same 200 x 200 map. See docs/preview-design.md Sec.4."
    },
    {
      "name": "HUGE_MAP",
      "category": "mapSize",
      "description": "Legacy name for the 220 x 220 map size (in-game description: Large).",
      "dimensions": 220,
      "mapSize": "Large",
      "verified": true,
      "notes": "Sourced from the Definitive RMS Scripting Guide (Zetnus), Conditionals section. Legacy and modern names are offset by one size from Normal upward: this label and MAPSIZE_LARGE are the same 220 x 220 map. See docs/preview-design.md Sec.4."
    },
    {
      "name": "GIGANTIC_MAP",
      "category": "mapSize",
      "description": "Legacy name for the 240 x 240 map size (in-game description: Huge).",
      "dimensions": 240,
      "mapSize": "Huge",
      "verified": true,
      "notes": "Sourced from the Definitive RMS Scripting Guide (Zetnus), Conditionals section. Legacy and modern names are offset by one size from Normal upward: this label and MAPSIZE_HUGE are the same 240 x 240 map. See docs/preview-design.md Sec.4."
    },
    {
      "name": "LUDIKRIS_MAP",
      "category": "mapSize",
      "description": "Legacy name for the 480 x 480 map size (in-game description: Ludicrous).",
      "dimensions": 480,
      "verified": true,
      "notes": "Sourced from the Definitive RMS Scripting Guide (Zetnus), Conditionals section. Legacy and modern names are offset by one size from Normal upward: this label and MAPSIZE_LUDICROUS are the same 480 x 480 map. See docs/preview-design.md Sec.4."
    },
    {
      "name": "MAPSIZE_MINI",
      "category": "mapSize",
      "description": "80 x 80 map size (in-game description: Miniature (1 player)).",
      "dimensions": 80,
      "verified": true,
      "notes": "Sourced from the Definitive RMS Scripting Guide (Zetnus), Conditionals section. DE only; added March 2024 to standardize the naming. Selectable in game only with the MORE_MAP_SIZES launch option."
    },
    {
      "name": "MAPSIZE_TINY",
      "category": "mapSize",
      "description": "120 x 120 map size (in-game description: Tiny (2 player)).",
      "dimensions": 120,
      "mapSize": "Tiny",
      "verified": true,
      "notes": "Sourced from the Definitive RMS Scripting Guide (Zetnus), Conditionals section. DE only; added March 2024 to standardize the naming."
    },
    {
      "name": "MAPSIZE_SMALL",
      "category": "mapSize",
      "description": "144 x 144 map size (in-game description: Small (3 player)).",
      "dimensions": 144,
      "mapSize": "Small",
      "verified": true,
      "notes": "Sourced from the Definitive RMS Scripting Guide (Zetnus), Conditionals section. DE only; added March 2024 to standardize the naming."
    },
    {
      "name": "MAPSIZE_MEDIUM",
      "category": "mapSize",
      "description": "168 x 168 map size (in-game description: Medium (4 player)).",
      "dimensions": 168,
      "mapSize": "Medium",
      "verified": true,
      "notes": "Sourced from the Definitive RMS Scripting Guide (Zetnus), Conditionals section. DE only; added March 2024 to standardize the naming."
    },
    {
      "name": "MAPSIZE_NORMAL",
      "category": "mapSize",
      "description": "200 x 200 map size (in-game description: Normal (6 player)).",
      "dimensions": 200,
      "mapSize": "Normal",
      "verified": true,
      "notes": "Sourced from the Definitive RMS Scripting Guide (Zetnus), Conditionals section. DE only; added March 2024 to standardize the naming."
    },
    {
      "name": "MAPSIZE_LARGE",
      "category": "mapSize",
      "description": "220 x 220 map size (in-game description: Large (8 player)).",
      "dimensions": 220,
      "mapSize": "Large",
      "verified": true,
      "notes": "Sourced from the Definitive RMS Scripting Guide (Zetnus), Conditionals section. DE only; added March 2024 to standardize the naming."
    },
    {
      "name": "MAPSIZE_HUGE",
      "category": "mapSize",
      "description": "240 x 240 map size (in-game description: Huge).",
      "dimensions": 240,
      "mapSize": "Huge",
      "verified": true,
      "notes": "Sourced from the Definitive RMS Scripting Guide (Zetnus), Conditionals section. DE only; added March 2024 to standardize the naming."
    },
    {
      "name": "MAPSIZE_GIANT",
      "category": "mapSize",
      "description": "252 x 252 map size (in-game description: Giant).",
      "dimensions": 252,
      "mapSize": "Giant",
      "verified": true,